{
 "schemaVersion": "planeon.oracle-identity/v1",
 "file": {
  "path": "tests/test_probe_kit_scope_oracle.py",
  "sha256": "f4a9772d55a08f4dcef1b18fbb6cc102388522418b48e6b372c49edb5374dd30"
 },
 "oracle": {
  "agentId": "a2d54e4f744c7928f",
  "model": "claude-opus-5-5"
 },
 "operator": {
  "role": "LANE_SESSION",
  "agentId": "0076662f-0b42-449b-aeff-3ca41d5c404c",
  "lane": "primary"
 },
 "author": {
  "agentIds": [
   "0076662f-0b42-449b-aeff-3ca41d5c404c"
  ]
 },
 "briefSha256": "d8c2d628ee6c859d252c22f970ab5603e89a519f559e0959fd600973a580056a",
 "candidateCommit": "4445613d327352fa5596ec45eaecc7026e6170ca",
 "launched": "2026-10-22T22:57:30+08:00",
 "finished": "2026-10-23T01:57:24+08:00",
 "ruling": {
  "decision": "KEEP",
  "by": "LANE_MONITOR",
  "ref": "MON-LPK0-ORACLE-KEEP; disclosed interruptions: a 429 stop and resume, and the slot/edge re-derivation resume after MON-LPK0-ADOPT-C6",
  "date": "2026-10-23"
 },
 "disclosures": [
  "first run, from the adopted README alone, on candidate c3: 104 tests, all passing; its findings (wrong-type gaps, a missing README rule-5 exception, an incomplete unquoted-cells row list, unstated sort exceptions, an HS53 table row) led to candidate c4 (MON-LPK0-ADOPT-C4)",
  "resumed on c4 by message (not relaunched) to widen the wrong-type test to every field and add the nested class probe: 410 tests, all passing",
  "interruption: an API spend-limit (429) stop; the same agent was resumed by message at 2026-10-23T00:52:25+08:00, with no relaunch",
  "resumed by message after MON-LPK0-ADOPT-C6 to re-derive only the slot (260) and edge values: five changed lines, 410/410 on c6; it reported the README's stale 'six predecessor rows' (fixed in c7)",
  "finished is the time of the oracle's last write to its files; the operator re-ran the file at candidateCommit (README c8, cmp-equal record, model and vectors): 410 passed"
 ]
}
