{
 "schemaVersion": "planeon.oracle-identity/v1",
 "file": {
  "path": "tests/test_language_placement_oracle.py",
  "sha256": "4fa51e886cca2e814a822430428df5f287c838ecdfb00d8a3942149c5dc5d6c6"
 },
 "oracle": {
  "agentId": "a27a06163bc50da08",
  "model": "claude-opus-5-5"
 },
 "operator": {
  "role": "LANE_SESSION",
  "agentId": "241d4b17-8eea-48d8-b3bc-79c6c27a3233",
  "lane": "parallel"
 },
 "author": {
  "agentIds": [
   "a5f17dc0bd391bd63"
  ]
 },
 "briefSha256": "33f61b5202f211879eeb8be7c6b3444ab7a3cac983bc63c57402d100399e4cc9",
 "candidateCommit": "62a29027e278e93b5df7eccfc827c44e24e1c8ab",
 "launched": "2026-10-26T08:58:07+08:00",
 "finished": "2026-10-26T09:06:16+08:00",
 "ruling": {
  "decision": "KEEP",
  "by": "LANE_MONITOR",
  "ref": "MON-GOV4-267-B",
  "date": "2026-10-26"
 },
 "disclosures": [
  "re-issued under MON-GOV4-267-B from the brief ORACLE_BRIEF.md (0debd0a9) and its addendum (briefSha256 above): real copies only (shutil.copy2, no hard links or symlinks), every copy removed at teardown, and R5's mutations per the design's content-location errata",
  "the first issue (028e73d4, 95 tests) passed 95/95 on c1 but hard-linked the root into pytest's base temp, which the chain refuses (mechanics blocker B1); it was written black-box from design revision 4 by the same agent (first run 2026-10-26T00:45:40 to 01:14:15)",
  "against c4a (62a29027), the re-issue: 102/102; scripts st_nlink 1 before and after; 0 entries left in its temp parent; test_copy_shares_no_inode passes",
  "slips (procedural): an unrequested extra run against the base copy; TMPDIR added to the run command for the H3 count; an awk heading scan of the design outside its section 11, printing only line numbers",
  "the launch context carried an auto-injected memory index and an account context; the oracle used neither"
 ]
}
